resource_id,resource_title,resource_url,tag1,tag2,tag3,tag4,tag5
1,How to Trade for Cheaper using DEX Aggregators,https://unmaskcrypto.com/learnings/dex-aggregator,dex,aggregator,beginner,tutorial,link,
2,What Is an Automated Market Maker (AMM)?,https://academy.binance.com/en/articles/what-is-an-automated-market-maker-amm,amm,dex,intermediate,article,link,
3,Tips for Trading on Uniswap,https://unmaskcrypto.com/learnings/trading-uniswap,amm,dex,beginner,article,link,
4,What Are Automated Market Makers?,https://www.gemini.com/cryptopedia/amm-what-are-automated-market-makers,amm,dex,beginner,article,link,
5,How AMM Works?,https://investotrend.com/how-amm-works/,amm,dex,intermediate,article,link,
6,Uniswap v3 Core whitepaper,https://uniswap.org/whitepaper-v3.pdf,amm,dex,advanced,whitepaper,link,
7,Uniswap v2 Core whitepaper,https://uniswap.org/whitepaper.pdf,amm,dex,advanced,whitepaper,link,
8,Automated Market Makers and Decentralized Exchanges: a DeFi Primer,https://papers.ssrn.com/sol3/papers.cfm?abstract_id=3722714,amm,dex,advanced,whitepaper,link,
9,UNISWAP-V2 CONTRACT WALK-THROUGH,https://ethereum.org/en/developers/tutorials/uniswap-v2-annotated-code/,amm,dex,intermediate,tutorial,link,
10,SoK: Oracles from the Ground Truth to Market Manipulation,https://arxiv.org/abs/2106.00667,oracle,,advanced,whitepaper,link,
11,Blockchain Oracle Design Patterns,https://arxiv.org/abs/2106.09349,oracle,,advanced,whitepaper,link,
12,Foundational Oracle Patterns: Connecting Blockchain to the Off-chain World,https://arxiv.org/abs/2007.14946,oracle,,advanced,whitepaper,link,
13,A First Look into DeFi Oracles,https://arxiv.org/abs/2005.04377,oracle,,advanced,whitepaper,link,
14,Byzantine fault Wikipedia,https://en.wikipedia.org/wiki/Byzantine_fault,oracle,,intermediate,wikipedia,link,
15,What Is Yield Farming in Decentralized Finance (DeFi)?,https://academy.binance.com/en/articles/what-is-yield-farming-in-decentralized-finance-defi#what-started-the-yield-farming-boom,yield,lending,intermediate,article,link,
16,Lending and Borrowing with Compound and Aave,https://thedefiant.io/lending-and-borrowing-with-compound-and-aave/,yield,lending,intermediate,tutorial,link,
17,"DeFi lending and borrowing, explained",https://cointelegraph.com/explained/defi-lending-and-borrowing-explained,yield,lending,beginner,article,link,
18,DYOR: Alchemix by 0xdef1,https://dyor.fi/alcx,yield,lending,advanced,widget,link,
19,Uniswap V3 Fee Calculator by Flipside,https://uniswapv3.flipsidecrypto.com/,yield,amm,advanced,widget,link,
20,Uniswap V3: A Quant Framework to model yield farming returns,https://medium.com/@DeFiScientist/uniswap-v3-a-quant-framework-to-model-yield-farming-returns-941a1600425e,yield,amm,intermediate,article,link,
21,Impermanent Loss Calculator for Evodex & Uniswap,https://chitty27.pythonanywhere.com/,divergence-loss,tool,beginner,widget,link,
22,Uniswap V3 Strategy Simulator,https://defi-lab.xyz/uniswapv3simulator,liquidity,amm,advanced,widget,link,
23,DeFi: In Simple Photos and How to Make Your First Transaction!,https://defieducation.substack.com/p/defi-in-simple-photos-and-how-to,yield,liquidity,intermediate,article,link,
24,Uniswap: Impermanent Loss and Risk Profile of a Liquidity Provider,https://arxiv.org/abs/2106.14404,divergence-loss,liquidity,advanced,whitepaper,link,
25,Uniswap v3: The Universal AMM,https://www.paradigm.xyz/2021/06/uniswap-v3-the-universal-amm/,amm,dex,advanced,article,link,
26,Uniswap V3 LP Tokens as Perpetual Put and Call Options,https://lambert-guillaume.medium.com/uniswap-v3-lp-tokens-as-perpetual-put-and-call-options-5b66219db827,options,liquidity,advanced,article,link,
27,Impermanent Loss Explained,https://academy.binance.com/en/articles/impermanent-loss-explained,divergence-loss,liquidity,intermediate,tutorial,link,
28,What is an Options Contract,https://insights.deribit.com/education/what-is-an-options-contract/,options,centralised-exchange,beginner,tutorial,link,
29,How Does a Centralized Cryptocurrency Exchange Work?,https://unmaskcrypto.com/learnings/cex-exchange,cex,centralised-exchange,beginner,article,link,
30,What Is Margin Trading?,https://academy.binance.com/en/articles/what-is-margin-trading,cex,centralised-exchange,intermediate,article,link,
31,DeFi Indexes,https://defiprime.com/defi-index,index,portfolio,intermediate,article,link,
32,Options Wikipedia,https://en.wikipedia.org/wiki/Option_(finance),options,risk-management,intermediate,article,link,
33,What are Options Contracts Binance,https://academy.binance.com/en/articles/what-are-options-contracts,options,centralised-exchange,intermediate,article,link,
34,Primer on basic option strategies - Deribit position builder,https://insights.deribit.com/market-research/deribit-position-builder-primer-on-basic-option-strategies/,options,,intermediate,article,link,
35,SoK: Decentralized Exchanges (DEX) withAutomated Market Maker (AMM) protocols,https://arxiv.org/pdf/2103.12732.pdf,amm,,advanced,whitepaper,link,
36,Oracles from the Ground Truth to Market Manipulation,https://arxiv.org/pdf/2106.00667.pdf,oracles,,advanced,whitepaper,link,
37,CIA Officer - twitter thread,https://twitter.com/officer_cia/status/1418018953742409738,oracles,,,tweet,link,
38,A Quick Introduction to Yield Farming,https://unmaskcrypto.com/learnings/yield-farming,Yield,,,article,link,
39,"Where does yield come from, anyway?",https://juliankoh.medium.com/where-does-yield-come-from-anyway-fc818c114bd5,Yield,,,article,link,
40,Nick Chong thread on yield,https://twitter.com/n2ckchong/status/1390494848478683136,Yield,,,tweet,link,
41,What is 0x,https://www.youtube.com/watch?v=c04eIt3FQ5I,DEX,,,video,link,
42,Decentralised exchanges,https://www.wikiwand.com/en/Decentralized_exchange,DEX,,,wikipedia,link,
43,What is a decentralised exchange,https://academy.binance.com/en/articles/what-is-a-decentralized-exchange-dex,DEX,,,article,link,
44,dydx,https://www.youtube.com/watch?v=PGE1uoiZTmM,DEX,,,video,link,
45,what are the risks of defi lending?,https://ethereum.stackexchange.com/questions/92272/what-are-the-risks-of-defi-lending,lending,,,article,link,
46,aave whitepaper,https://github.com/aave/protocol-v2/blob/master/aave-v2-whitepaper.pdf,lending,,advanced,whitepaper,link,
47,compound whitepaper,https://compound.finance/documents/Compound.Whitepaper.pdf,lending,,advanced,whitepaper,link,
48,vicyn impermanent loss calculator,https://vicyyn.com/,lending,,,tool,link,
49,UNISWAP: Impermanent Loss and Risk Profile of a Liquidity Provider,https://arxiv.org/pdf/2106.14404.pdf,lending,,advanced,whitepaper,link,
50,MINER EXTRACTABLE VALUE (MEV),https://ethereum.org/en/developers/docs/mev/,mev,,,article,link,
51,Flashbots: Frontrunning the MEV Crisis,https://medium.com/flashbots/frontrunning-the-mev-crisis-40629a613752,mev,,,article,link,
52,flashbots github,https://github.com/flashbots/pm,mev,developer,,github,link,
53,How to approach crypto – Essential tips (Ledger),https://www.ledger.com/academy/how-to-approach-crypto,hold,,,,link,
54,Self-Custody: How to be your own bank (Ledger),https://www.ledger.com/academy/tips-to-trust-yourself-in-becoming-your-own-bank,hold,,,,link,
55,"Not your keys, not your coins (Ledger)",https://www.ledger.com/academy/not-your-keys-not-your-coins-why-it-matters,hold,,,,link,
56,What is a cryptocurrency? (Coinbase),https://www.coinbase.com/learn/crypto-basics/what-is-cryptocurrency,hold,,,,link,
57,What is a Blockchain? (Coinbase),https://www.coinbase.com/learn/crypto-basics/what-is-a-blockchain,hold,,,,link,
58,What is Bitcoin? (Coinbase),https://www.coinbase.com/learn/crypto-basics/what-is-bitcoin,hold,,,,link,
59,What is a Stablecoin? (Coinbase),https://www.coinbase.com/learn/crypto-basics/what-is-a-stablecoin,hold,,,,link,
60,What are the Key Properties of Bitcoin?,https://nakamoto.com/what-are-the-key-properties-of-bitcoin/,hold,,,,link,
61,What is Ethereum?,https://ethereum.org/en/what-is-ethereum/,hold,,,,link,
62,What are Automated Market Makers? (Gemini),https://www.gemini.com/cryptopedia/amm-what-are-automated-market-makers,amm,,,,link,
63,What is an Automated Market Maker? (Binance),https://academy.binance.com/en/articles/what-is-an-automated-market-maker-amm,amm,,,,link,
64,What is an Automated Market Maker? (Coinmarketcap),https://coinmarketcap.com/alexandria/glossary/automated-market-maker-amm,amm,,,,link,
65,A Mathematical View of Automated Market Maker (AMM) Algorithms and Its Future,https://medium.com/anchordao-lab/automated-market-maker-amm-algorithms-and-its-future-f2d5e6cc624a,amm,,,,link,
66,What is Staking? (Coinbase),https://www.coinbase.com/learn/crypto-basics/what-is-staking,staking,,,,link,
67,Uniswap math desmos thread (Dan Robinson),https://twitter.com/danrobinson/status/1429972775511408651,,,,,link,
68,CoinMarketCap Crypto Glossary,https://coinmarketcap.com/alexandria/glossary,,,,,link,
69,The Crypto Climate Revolution,https://medium.com/@themantis/the-crypto-climate-revolution-why-a-technology-condemned-by-environmentalists-may-become-a-key-e9ea7313587d,,,,,link,
70,How to make a jump from Web2 hacking to Web3 hacking,https://twitter.com/adrianhetman/status/1475550508354093072,developer,beginner,intermediate,tweet,link,
71,Yul (and Some Solidity) Optimizations and Tricks,https://hackmd.io/@gn56kcRBQc6mOi7LCgbv1g/rJez8O8st,developer,yul,solidity,article,link,
72,Layer 2 rollups,https://ethereum.org/en/developers/docs/scaling/layer-2-rollups/,layer 2,rollups,intermediate,article,link,
73,defi derivatives,https://github.com/0xperp/defi-derivatives,,,,,link,
74,How to survive in crypto,https://www.youtube.com/watch?v=udgu2O3MZ-Q,,,,video,link,
75,Known Physical Bitcoin Attacks,https://github.com/jlopp/physical-bitcoin-attacks/blob/master/README.md,security,bad-things,,github,link,
76,Yearn DeFi glossary,https://docs.yearn.finance/resources/defi-glossary,defi,,,,link,
77,Casual code review of metamask's crypto,https://blog.cryptographyengineering.com/2022/01/14/an-extremely-casual-code-review-of-metamasks-crypto/,security,,,,link,
78,A thread on punk sandwiches,https://twitter.com/bertcmiller/status/1482086447775580161,nft,security,,tweet,link,
79,Kuro's bridging spreadsheet,https://docs.google.com/spreadsheets/d/1jYZOfU2R3PdzRmnY9Nfc4pzerX_YSInNdyhtSj_3oWY/htmlview,,,,,link,
80,Assessing Risk in Decentralized Finance,https://www.moodysanalytics.com/articles/2021/block_by_block_assessing_risk_in_decentralized_finance,risk,defi,,article,link,
81,"What is risk, who bears risk, and how could we think about risk in DeFi?",https://twitter.com/nope_its_lily/status/1483556375028387840,risk,defi,,tweet,link,
82,Uniswap: A Good Deal for Liquidity Providers?,https://pintail.medium.com/uniswap-a-good-deal-for-liquidity-providers-104c0b6816f2,,,,,link,
83,an AMM koan,https://twitter.com/_Dave__White_/status/1318307774674006016,amm,lp,divergence-loss,tweet,link,
84,vimpermanent loss calculator,https://dailydefi.org/tools/impermanent-loss-calculator/,amm,lp,divergence-loss,tool,link,